{
  "$schema": "./schemas/tokens.schema.json",
  "meta": {
    "source": "Meridian OS.dc.html mockup",
    "authoritative_space": "oklch",
    "version": 1
  },
  "font": {
    "ui": [
      "Schibsted Grotesk",
      "Inter",
      "Noto Sans"
    ],
    "mono": [
      "JetBrains Mono"
    ],
    "size": {
      "body": 14,
      "secondary": 13.5,
      "caption": 12.5,
      "overline": 11,
      "title": 20,
      "hero": 22
    },
    "weight": {
      "regular": 400,
      "medium": 500,
      "semibold": 600,
      "bold": 700
    },
    "overline": {
      "letterSpacing": "0.08em",
      "transform": "uppercase",
      "weight": 600
    }
  },
  "color": {
    "light": {
      "ink": {
        "primary": "#1a1a22",
        "secondary": "#55555f",
        "tertiary": "#7a7a86",
        "hint": "#9a9aa6"
      },
      "surface": {
        "window": "rgba(252,252,254,0.94)",
        "sidebar": "rgba(245,245,250,0.60)",
        "card": "rgba(0,0,0,0.035)",
        "hover": "rgba(0,0,0,0.05)",
        "hoverStrong": "rgba(0,0,0,0.07)",
        "hairline": "rgba(0,0,0,0.06)",
        "chipSoft": "#d6f0f9"
      },
      "onAccent": "#ffffff"
    },
    "dark": {
      "ink": {
        "primary": "#ececf2",
        "secondary": "#b8b8c4",
        "tertiary": "#8f8f9c",
        "hint": "#6f6f7c"
      },
      "surface": {
        "base": "#131318",
        "window": "rgba(28,28,36,0.94)",
        "sidebar": "rgba(23,23,31,0.60)",
        "card": "rgba(255,255,255,0.045)",
        "hover": "rgba(255,255,255,0.06)",
        "hoverStrong": "rgba(255,255,255,0.09)",
        "hairline": "rgba(255,255,255,0.07)",
        "chipSoft": "#0e3a4a"
      },
      "onAccent": "#ffffff"
    },
    "accent": {
      "blue": {
        "oklch": "oklch(0.62 0.14 220)",
        "hex": "#0098c0",
        "hoverHex": "#0079a0",
        "darkHex": "#2fb3d9"
      },
      "violet": {
        "oklch": "oklch(0.62 0.14 285)",
        "hex": "#7f78d6",
        "darkHex": "#9a93ea"
      },
      "green": {
        "oklch": "oklch(0.62 0.14 160)",
        "hex": "#019f68",
        "darkHex": "#2dbb84"
      },
      "red": {
        "oklch": "oklch(0.62 0.14 25)",
        "hex": "#cd605a",
        "darkHex": "#e57e77"
      },
      "graphite": {
        "oklch": "oklch(0.45 0.02 260)",
        "hex": "#4f5661",
        "darkHex": "#8b93a1"
      },
      "default": "blue"
    },
    "system": {
      "closeHover": "#e5484d",
      "closeHoverInk": "#ffffff"
    },
    "logoGradient": [
      "#00abd3",
      "#2a5fb7"
    ],
    "heroGradient": [
      "#4c6ebd",
      "#17a9cb"
    ]
  },
  "wallpaper": {
    "softViolet": {
      "angle": 160,
      "stops": [
        [
          "#c3bfe3",
          0
        ],
        [
          "#6d7ac2",
          55
        ],
        [
          "#2c488e",
          100
        ]
      ],
      "glows": [
        {
          "cx": 0.16,
          "cy": 0.1,
          "r": 0.68,
          "color": "#ffffff",
          "opacity": 0.3
        },
        {
          "cx": 0.88,
          "cy": 0.86,
          "r": 0.74,
          "color": "#ffffff",
          "opacity": 0.22
        }
      ]
    },
    "dusk": {
      "angle": 160,
      "stops": [
        [
          "#ecc5a7",
          0
        ],
        [
          "#bd615b",
          60
        ],
        [
          "#4b346f",
          100
        ]
      ],
      "glows": [
        {
          "cx": 0.16,
          "cy": 0.1,
          "r": 0.68,
          "color": "#ffffff",
          "opacity": 0.3
        },
        {
          "cx": 0.88,
          "cy": 0.86,
          "r": 0.74,
          "color": "#ffffff",
          "opacity": 0.22
        }
      ]
    },
    "deepTeal": {
      "angle": 160,
      "stops": [
        [
          "#90cacd",
          0
        ],
        [
          "#008192",
          55
        ],
        [
          "#003f64",
          100
        ]
      ],
      "glows": [
        {
          "cx": 0.16,
          "cy": 0.1,
          "r": 0.68,
          "color": "#ffffff",
          "opacity": 0.3
        },
        {
          "cx": 0.88,
          "cy": 0.86,
          "r": 0.74,
          "color": "#ffffff",
          "opacity": 0.22
        }
      ]
    },
    "default": "softViolet"
  },
  "radius": {
    "window": 14,
    "panel": 14,
    "popup": 18,
    "card": 12,
    "control": 10,
    "field": 8,
    "pill": 999
  },
  "elevation": {
    "window": "0 24px 70px rgba(20,15,60,0.35)",
    "popup": "0 30px 80px rgba(20,15,60,0.40)",
    "bar": "0 10px 30px rgba(20,15,60,0.30)",
    "card": "0 1px 4px rgba(0,0,0,0.06)",
    "innerLight": "inset 0 0 0 1px rgba(255,255,255,0.5)"
  },
  "material": {
    "blur": 30,
    "blurPopup": 36,
    "saturate": 1.4
  },
  "layout": {
    "taskbarHeight": 52,
    "taskbarMargin": 12,
    "startWidth": 560,
    "quickWidth": 350,
    "windowControl": 27,
    "taskIcon": 28,
    "taskHit": 40,
    "desktopCell": 86,
    "sidebarWidth": 185
  },
  "motion": {
    "popup": {
      "duration": 180,
      "easing": "ease-out",
      "travel": 14
    },
    "toggle": {
      "duration": 200
    },
    "window": {
      "duration": 175
    },
    "reducedMotionHonored": true
  }
}
